Renaissance	renaissance_finance_field_ready_bill_of_exchange_clearing_0091	Field Ready Bill Of Exchange Clearing	Workshops, merchants, navies, and scholars used field ready accounting technology for clearing bill of exchange systems.	double_entry_bookkeeping,joint_stock_companies
Industrial	industrial_finance_high_throughput_account_pricing_0091	High Throughput Account Pricing	Factories, utilities, laboratories, and cities used high throughput insurance technology for pricing account systems.	telephone_directory_services,telegraph_news_tickers
Modern	modern_finance_remote_account_inventory_0091	Remote Account Inventory	Networked institutions and automated systems used remote insurance technology for inventory account systems.	digital_payment_wallets,blockchain_cryptocurrency
Future	future_finance_remote_account_inventory_0091	Remote Account Inventory	Advanced automated societies could use remote insurance technology for inventory account systems.	quantum_secured_financial_networks,ai_mediated_supply_negotiation
Ancient	ancient_infrastructure_redundant_street_drain_repairing_0091	Redundant Street Drain Repairing	Early communities used redundant construction technology for repairing street drain systems.	basic_shelter,irrigation_canals_local
Classical	classical_infrastructure_modular_cistern_metering_0091	Modular Cistern Metering	Complex states and cities used modular bridge technology for metering cistern systems.	aqueducts,concrete
Medieval	medieval_infrastructure_portable_harbor_quay_inspecting_0091	Portable Harbor Quay Inspecting	Guilds, courts, monasteries, and towns used portable water technology for inspecting harbor quay systems.	gothic_architecture,municipal_fire_watch
Renaissance	renaissance_infrastructure_specialized_theater_floor_dredging_0091	Specialized Theater Floor Dredging	Workshops, merchants, navies, and scholars used specialized building technology for dredging theater floor systems.	military_engineer_corps,precision_map_engraving
Industrial	industrial_infrastructure_standardized_station_drainage_0091	Standardized Station Drainage	Factories, utilities, laboratories, and cities used standardized housing technology for drainage station systems.	urban_water_chlorination,urban_electric_subways
Modern	modern_infrastructure_large_scale_station_lighting_0091	Large Scale Station Lighting	Networked institutions and automated systems used large scale housing technology for lighting station systems.	digital_twin_infrastructure,internet_of_things_iot_ubiquitous_connectivity
Future	future_infrastructure_large_scale_station_lighting_0091	Large Scale Station Lighting	Advanced automated societies could use large scale housing technology for lighting station systems.	robotic_construction_swarms,self_healing_civil_infrastructure
Ancient	ancient_security_regulated_sling_shielding_0091	Regulated Sling Shielding	Early communities used regulated armor technology for shielding sling systems.	organized_warfare,atlatl_spear_throwers
Classical	classical_security_high_throughput_shield_wall_supplying_0091	High Throughput Shield Wall Supplying	Complex states and cities used high throughput defense technology for supplying shield wall systems.	organized_military_formations,military_field_medicine
Medieval	medieval_security_low_waste_cannon_drilling_0091	Low Waste Cannon Drilling	Guilds, courts, monasteries, and towns used low waste armor technology for drilling cannon systems.	cannons,castle_signal_beacons
Renaissance	renaissance_security_compact_musket_drill_ranging_0091	Compact Musket Drill Ranging	Workshops, merchants, navies, and scholars used compact military technology for ranging musket drill systems.	naval_gunnery_tables,cannons
Industrial	industrial_security_field_ready_signal_lamp_signaling_0091	Field Ready Signal Lamp Signaling	Factories, utilities, laboratories, and cities used field ready defense technology for signaling signal lamp systems.	electric_arc_lighting,railway_signal_interlocking
Modern	modern_security_cooperative_signal_drilling_0091	Cooperative Signal Drilling	Networked institutions and automated systems used cooperative armor technology for drilling signal systems.	cyber_threat_intelligence,cybersecurity_operations_centers
Future	future_security_cooperative_signal_drilling_0091	Cooperative Signal Drilling	Advanced automated societies could use cooperative armor technology for drilling signal systems.	quantum_encryption,ai_model_auditing
Modern	modern_space_continuous_solar_array_sampling_0091	Continuous Solar Array Sampling	Networked institutions and automated systems used continuous satellite technology for sampling solar array systems.	satellite_technology,space_stations
Future	future_space_continuous_telescope_propulsion_0091	Continuous Telescope Propulsion	Advanced automated societies could use continuous terraform technology for propulsion telescope systems.	space_colonization,space_resource_refineries
Ancient	ancient_culture_cooperative_drum_preserving_0091	Cooperative Drum Preserving	Early communities used cooperative ritual technology for preserving drum systems.	shamanism_animism,ochre_pigment_processing
Classical	classical_culture_low_waste_drama_cataloging_0091	Low Waste Drama Cataloging	Complex states and cities used low waste ritual technology for cataloging drama systems.	theater_stage_machinery,glass_mosaic_tesserae
Medieval	medieval_culture_regulated_drama_reproduction_0091	Regulated Drama Reproduction	Guilds, courts, monasteries, and towns used regulated ritual technology for reproduction drama systems.	monastic_scriptoria,mechanical_bell_striking
Renaissance	renaissance_culture_field_ready_drama_notation_0091	Field Ready Drama Notation	Workshops, merchants, navies, and scholars used field ready ritual technology for notation drama systems.	printed_music_notation,public_art_academies
Industrial	industrial_culture_high_throughput_drama_composition_0091	High Throughput Drama Composition	Factories, utilities, laboratories, and cities used high throughput ritual technology for composition drama systems.	photographic_halftone_printing,newspaper_periodicals
Modern	modern_culture_remote_drama_curation_0091	Remote Drama Curation	Networked institutions and automated systems used remote ritual technology for curation drama systems.	streaming_music_platforms,social_media_content_moderation
Future	future_culture_remote_drama_curation_0091	Remote Drama Curation	Advanced automated societies could use remote ritual technology for curation drama systems.	ai_cultural_memory_archives,ai_personal_tutoring_companions
Ancient	ancient_agriculture_compact_oilseed_sorting_0092	Compact Oilseed Sorting	Early communities used compact irrigation technology for sorting oilseed systems.	agriculture,pottery_storage_amphorae
Classical	classical_agriculture_redundant_oilseed_storage_0092	Redundant Oilseed Storage	Complex states and cities used redundant irrigation technology for storage oilseed systems.	state_grain_price_controls,tax_accounting
Medieval	medieval_agriculture_large_scale_oilseed_drying_0092	Large Scale Oilseed Drying	Guilds, courts, monasteries, and towns used large scale irrigation technology for drying oilseed systems.	crop_rotation_three_field,watermills
Renaissance	renaissance_agriculture_modular_oilseed_watering_0092	Modular Oilseed Watering	Workshops, merchants, navies, and scholars used modular irrigation technology for watering oilseed systems.	experimental_botany_gardens,chemical_recipe_books
Industrial	industrial_agriculture_portable_flour_mill_drying_0092	Portable Flour Mill Drying	Factories, utilities, laboratories, and cities used portable grain technology for drying flour mill systems.	chemical_fertilizers,industrial_canning_lines
Modern	modern_agriculture_field_ready_oilseed_testing_0092	Field Ready Oilseed Testing	Networked institutions and automated systems used field ready irrigation technology for testing oilseed systems.	gps_guided_logistics,satellite_remote_sensing
Future	future_agriculture_field_ready_oilseed_testing_0092	Field Ready Oilseed Testing	Advanced automated societies could use field ready irrigation technology for testing oilseed systems.	vertical_farming_megafarms,synthetic_food_bioreactors
Ancient	ancient_materials_high_throughput_basket_chipping_0092	High Throughput Basket Chipping	Early communities used high throughput bronze technology for chipping basket systems.	bronze_working,woodworking_basic
Classical	classical_materials_compact_mosaic_tile_blowing_0092	Compact Mosaic Tile Blowing	Complex states and cities used compact tool technology for blowing mosaic tile systems.	glassmaking,concrete
Medieval	medieval_materials_field_ready_chain_link_casting_0092	Field Ready Chain Link Casting	Guilds, courts, monasteries, and towns used field ready leather technology for casting chain link systems.	advanced_metallurgy_medieval,fulling_mills
Renaissance	renaissance_materials_redundant_paper_sheet_weaving_0092	Redundant Paper Sheet Weaving	Workshops, merchants, navies, and scholars used redundant tool technology for weaving paper sheet systems.	chemical_assay_laboratories,standardized_typefounding
Industrial	industrial_materials_large_scale_polymer_cutting_0092	Large Scale Polymer Cutting	Factories, utilities, laboratories, and cities used large scale textile technology for cutting polymer systems.	precision_machine_tools,bessemer_steel_conversion
Modern	modern_materials_low_waste_polymer_machining_0092	Low Waste Polymer Machining	Networked institutions and automated systems used low waste textile technology for machining polymer systems.	computer_aided_manufacturing_cam_systems,3d_printing_additive_manufacturing
Future	future_materials_low_waste_polymer_machining_0092	Low Waste Polymer Machining	Advanced automated societies could use low waste textile technology for machining polymer systems.	nanotechnology,quantum_materials_foundries
Ancient	ancient_energy_cooperative_bellows_kindling_0092	Cooperative Bellows Kindling	Early communities used cooperative lamp technology for kindling bellows systems.	charcoal_production,fire_control
Classical	classical_energy_low_waste_bellows_metering_0092	Low Waste Bellows Metering	Complex states and cities used low waste furnace technology for metering bellows systems.	water_clock_timekeeping,public_bath_heating
Medieval	medieval_energy_regulated_bellows_pumping_0092	Regulated Bellows Pumping	Guilds, courts, monasteries, and towns used regulated forge technology for pumping bellows systems.	watermills,windmills
Renaissance	renaissance_energy_field_ready_forge_fire_pressing_0092	Field Ready Forge Fire Pressing	Workshops, merchants, navies, and scholars used field ready draft technology for pressing forge fire systems.	clockwork_mechanisms,experimental_mining_assays
Industrial	industrial_energy_high_throughput_lead_acid_battery_stoking_0092	High Throughput Lead Acid Battery Stoking	Factories, utilities, laboratories, and cities used high throughput battery technology for stoking lead acid battery systems.	steam_turbine_power_generation,electrical_grid_early_distribution
Modern	modern_energy_remote_water_ignition_0092	Remote Water Ignition	Networked institutions and automated systems used remote fuel technology for ignition water systems.	solar_photovoltaics,renewable_microgrids
Future	future_energy_remote_water_ignition_0092	Remote Water Ignition	Advanced automated societies could use remote fuel technology for ignition water systems.	fusion_power,space_based_solar_power
Ancient	ancient_transport_high_throughput_causeway_hauling_0092	High Throughput Causeway Hauling	Early communities used high throughput trail technology for hauling causeway systems.	wheeled_vehicles,wooden_sledges
Classical	classical_transport_compact_ferry_loading_0092	Compact Ferry Loading	Complex states and cities used compact ship technology for loading ferry systems.	roads,harbor_customs_houses
Medieval	medieval_transport_field_ready_wayhouse_convoying_0092	Field Ready Wayhouse Convoying	Guilds, courts, monasteries, and towns used field ready navigation technology for convoying wayhouse systems.	compass,port_crane_harbor_works
Renaissance	renaissance_transport_redundant_cargo_manifest_surveying_0092	Redundant Cargo Manifest Surveying	Workshops, merchants, navies, and scholars used redundant map technology for surveying cargo manifest systems.	cartography,merchant_marine_registry
Industrial	industrial_transport_large_scale_motor_bus_scheduling_0092	Large Scale Motor Bus Scheduling	Factories, utilities, laboratories, and cities used large scale canal technology for scheduling motor bus systems.	railroads,internal_combustion_engine
Modern	modern_transport_low_waste_truck_navigation_0092	Low Waste Truck Navigation	Networked institutions and automated systems used low waste road technology for navigation truck systems.	gps_guided_logistics,ride_hailing_platforms
Future	future_transport_low_waste_truck_navigation_0092	Low Waste Truck Navigation	Advanced automated societies could use low waste road technology for navigation truck systems.	fusion_rockets,space_elevators
Ancient	ancient_computing_high_throughput_scribe_kit_counting_0092	High Throughput Scribe Kit Counting	Early communities used high throughput tablet technology for counting scribe kit systems.	writing,clay_tablet_receipts
Classical	classical_computing_compact_warehouse_receipt_filing_0092	Compact Warehouse Receipt Filing	Complex states and cities used compact algorithm technology for filing warehouse receipt systems.	libraries,court_transcript_scribes
Medieval	medieval_computing_field_ready_scriptorium_index_copying_0092	Field Ready Scriptorium Index Copying	Guilds, courts, monasteries, and towns used field ready calculation technology for copying scriptorium index systems.	universities,mechanical_clocks
Renaissance	renaissance_computing_redundant_book_catalog_auditing_0092	Redundant Book Catalog Auditing	Workshops, merchants, navies, and scholars used redundant table technology for auditing book catalog systems.	mechanical_calculators_early,calculus_formalization
Industrial	industrial_computing_large_scale_factory_ticket_sorting_0092	Large Scale Factory Ticket Sorting	Factories, utilities, laboratories, and cities used large scale accounting technology for sorting factory ticket systems.	typewriter_office_workflows,scientific_management_time_studies
Modern	modern_computing_low_waste_interface_optimization_0092	Low Waste Interface Optimization	Networked institutions and automated systems used low waste cloud technology for optimization interface systems.	internet,cloud_computing_distributed_systems
Future	future_computing_low_waste_interface_optimization_0092	Low Waste Interface Optimization	Advanced automated societies could use low waste cloud technology for optimization interface systems.	quantum_computing,large_language_models
Ancient	ancient_media_remote_drum_signal_reciting_0092	Remote Drum Signal Reciting	Early communities used remote writing technology for reciting drum signal systems.	oral_tradition_storytelling,writing
Classical	classical_media_regulated_library_shelf_cataloging_0092	Regulated Library Shelf Cataloging	Complex states and cities used regulated postal technology for cataloging library shelf systems.	libraries,postal_relay_systems
Medieval	medieval_media_cooperative_book_chain_illuminating_0092	Cooperative Book Chain Illuminating	Guilds, courts, monasteries, and towns used cooperative manuscript technology for illuminating book chain systems.	paper_making,monastic_scriptoria
Renaissance	renaissance_media_high_throughput_map_sheet_advertising_0092	High Throughput Map Sheet Advertising	Workshops, merchants, navies, and scholars used high throughput illustration technology for advertising map sheet systems.	printing_press,newspaper_periodicals
Industrial	industrial_media_low_waste_photograph_card_photographing_0092	Low Waste Photograph Card Photographing	Factories, utilities, laboratories, and cities used low waste newspaper technology for photographing photograph card systems.	telegraph,photographic_halftone_printing
Modern	modern_media_seasonal_signal_moderation_0092	Seasonal Signal Moderation	Networked institutions and automated systems used seasonal media technology for moderation signal systems.	world_wide_web,social_media
Future	future_media_seasonal_signal_moderation_0092	Seasonal Signal Moderation	Advanced automated societies could use seasonal media technology for moderation signal systems.	ai_personal_memory_systems,quantum_internet
Ancient	ancient_medicine_low_waste_wash_basin_dressing_0092	Low Waste Wash Basin Dressing	Early communities used low waste sanitation technology for dressing wash basin systems.	herbalism,primitive_surgery_trepanation
Classical	classical_medicine_field_ready_veterinary_splint_bandaging_0092	Field Ready Veterinary Splint Bandaging	Complex states and cities used field ready health technology for bandaging veterinary splint systems.	pharmacopoeia,medical_case_notes
Medieval	medieval_medicine_high_throughput_bandage_roll_nursing_0092	High Throughput Bandage Roll Nursing	Guilds, courts, monasteries, and towns used high throughput hospital technology for nursing bandage roll systems.	hospitals_early,university_medical_studies
Renaissance	renaissance_medicine_large_scale_medical_casebook_dosing_0092	Large Scale Medical Casebook Dosing	Workshops, merchants, navies, and scholars used large scale health technology for dosing medical casebook systems.	anatomical_theater_design,chemical_recipe_books
Industrial	industrial_medicine_compact_antiseptic_spray_recording_0092	Compact Antiseptic Spray Recording	Factories, utilities, laboratories, and cities used compact laboratory technology for recording antiseptic spray systems.	vaccination,public_health_laboratories
Modern	modern_medicine_regulated_pathogen_monitoring_0092	Regulated Pathogen Monitoring	Networked institutions and automated systems used regulated gene technology for monitoring pathogen systems.	electronic_health_records,dna_sequencing
Future	future_medicine_regulated_pathogen_monitoring_0092	Regulated Pathogen Monitoring	Advanced automated societies could use regulated gene technology for monitoring pathogen systems.	synthetic_biology,ai_clinical_care_networks
Ancient	ancient_science_regulated_grain_measure_measuring_0092	Regulated Grain Measure Measuring	Early communities used regulated astronomy technology for measuring grain measure systems.	calendars,field_boundary_survey_stones
Classical	classical_science_high_throughput_fluid_mapping_0092	High Throughput Fluid Mapping	Complex states and cities used high throughput physics technology for mapping fluid systems.	geometry,astrolabe_early
Medieval	medieval_science_low_waste_fluid_calibrating_0092	Low Waste Fluid Calibrating	Guilds, courts, monasteries, and towns used low waste physics technology for calibrating fluid systems.	universities_research_curricula,astrolabe_quadrant
Renaissance	renaissance_science_compact_fluid_sampling_0092	Compact Fluid Sampling	Workshops, merchants, navies, and scholars used compact physics technology for sampling fluid systems.	scientific_method,telescope
Industrial	industrial_science_field_ready_fluid_modeling_0092	Field Ready Fluid Modeling	Factories, utilities, laboratories, and cities used field ready physics technology for modeling fluid systems.	radioactivity_discovery,laboratory_diagnostic_medicine
Modern	modern_science_cooperative_fluid_standardizing_0092	Cooperative Fluid Standardizing	Networked institutions and automated systems used cooperative physics technology for standardizing fluid systems.	cloud_data_warehouses,satellite_remote_sensing
Future	future_science_cooperative_fluid_standardizing_0092	Cooperative Fluid Standardizing	Advanced automated societies could use cooperative physics technology for standardizing fluid systems.	ai_scientist_automated_discovery,quantum_sensors_high_precision_measurement
Ancient	ancient_governance_field_ready_militia_roster_registering_0092	Field Ready Militia Roster Registering	Early communities used field ready public technology for registering militia roster systems.	taxation_and_tribute,census
Classical	classical_governance_large_scale_standard_licensing_0092	Large Scale Standard Licensing	Complex states and cities used large scale military technology for licensing standard systems.	bureaucracy,tax_accounting
Medieval	medieval_governance_compact_standard_inspection_0092	Compact Standard Inspection	Guilds, courts, monasteries, and towns used compact military technology for inspection standard systems.	market_town_charters,guilds
Renaissance	renaissance_governance_portable_standard_planning_0092	Portable Standard Planning	Workshops, merchants, navies, and scholars used portable military technology for planning standard systems.	patent_systems,military_engineer_corps
Industrial	industrial_governance_redundant_standard_adjudication_0092	Redundant Standard Adjudication	Factories, utilities, laboratories, and cities used redundant military technology for adjudication standard systems.	labor_unions_collective_bargaining,industrial_safety_codes
Modern	modern_governance_high_throughput_standard_coordination_0092	High Throughput Standard Coordination	Networked institutions and automated systems used high throughput military technology for coordination standard systems.	digital_identity_federation,cybersecurity_operations_centers
Future	future_governance_high_throughput_standard_coordination_0092	High Throughput Standard Coordination	Advanced automated societies could use high throughput military technology for coordination standard systems.	ai_governance_ethics_frameworks_robust,ai_treaty_verification_systems
Ancient	ancient_finance_regulated_cargo_seal_weighing_0092	Regulated Cargo Seal Weighing	Early communities used regulated currency technology for weighing cargo seal systems.	barter,clay_tablet_receipts
Classical	classical_finance_high_throughput_grain_bank_minting_0092	High Throughput Grain Bank Minting	Complex states and cities used high throughput merchant technology for minting grain bank systems.	currency,harbor_customs_houses
Medieval	medieval_finance_low_waste_cargo_bond_clearing_0092	Low Waste Cargo Bond Clearing	Guilds, courts, monasteries, and towns used low waste merchant technology for clearing cargo bond systems.	banking_early_forms,bills_of_exchange_early_finance
Renaissance	renaissance_finance_compact_customs_account_underwriting_0092	Compact Customs Account Underwriting	Workshops, merchants, navies, and scholars used compact credit technology for underwriting customs account systems.	double_entry_bookkeeping,joint_stock_companies
Industrial	industrial_finance_field_ready_retail_auditing_0092	Field Ready Retail Auditing	Factories, utilities, laboratories, and cities used field ready bank technology for auditing retail systems.	telephone_directory_services,telegraph_news_tickers
Modern	modern_finance_cooperative_retail_reconciliation_0092	Cooperative Retail Reconciliation	Networked institutions and automated systems used cooperative bank technology for reconciliation retail systems.	digital_payment_wallets,blockchain_cryptocurrency
Future	future_finance_cooperative_retail_reconciliation_0092	Cooperative Retail Reconciliation	Advanced automated societies could use cooperative bank technology for reconciliation retail systems.	quantum_secured_financial_networks,ai_mediated_supply_negotiation
Ancient	ancient_infrastructure_portable_mudbrick_wall_digging_0092	Portable Mudbrick Wall Digging	Early communities used portable construction technology for digging mudbrick wall systems.	basic_shelter,irrigation_canals_local
Classical	classical_infrastructure_standardized_sewer_culvert_vaulting_0092	Standardized Sewer Culvert Vaulting	Complex states and cities used standardized construction technology for vaulting sewer culvert systems.	aqueducts,concrete
Medieval	medieval_infrastructure_modular_market_hall_draining_0092	Modular Market Hall Draining	Guilds, courts, monasteries, and towns used modular urban technology for draining market hall systems.	gothic_architecture,municipal_fire_watch
Renaissance	renaissance_infrastructure_high_capacity_stone_bridge_draining_0092	High Capacity Stone Bridge Draining	Workshops, merchants, navies, and scholars used high capacity water technology for draining stone bridge systems.	military_engineer_corps,precision_map_engraving
Industrial	industrial_infrastructure_specialized_street_inspection_0092	Specialized Street Inspection	Factories, utilities, laboratories, and cities used specialized building technology for inspection street systems.	urban_water_chlorination,urban_electric_subways
Modern	modern_infrastructure_redundant_street_reinforcement_0092	Redundant Street Reinforcement	Networked institutions and automated systems used redundant building technology for reinforcement street systems.	digital_twin_infrastructure,internet_of_things_iot_ubiquitous_connectivity
Future	future_infrastructure_redundant_street_reinforcement_0092	Redundant Street Reinforcement	Advanced automated societies could use redundant building technology for reinforcement street systems.	robotic_construction_swarms,self_healing_civil_infrastructure
Ancient	ancient_security_low_waste_ditch_patrolling_0092	Low Waste Ditch Patrolling	Early communities used low waste weapon technology for patrolling ditch systems.	organized_warfare,atlatl_spear_throwers
Classical	classical_security_field_ready_frontier_fort_drilling_0092	Field Ready Frontier Fort Drilling	Complex states and cities used field ready military technology for drilling frontier fort systems.	organized_military_formations,military_field_medicine
Medieval	medieval_security_high_throughput_armory_patrolling_0092	High Throughput Armory Patrolling	Guilds, courts, monasteries, and towns used high throughput castle technology for patrolling armory systems.	cannons,castle_signal_beacons
